project,pull_number,pull_type,id,text,classification,indicator
nifi,4767,review,561227339,Perhaps renaming this variable to something like `DEFAULT_STORE_TYPE` would clarify the reason for declaring it here as opposed to just using the enum value where necessary.,code_debt,low_quality_code
incubator-doris,3587,review,425210765,The second parameter is better to be a complete sentence.,code_debt,low_quality_code
cloudstack,768,review,39469736,Why are deprecated methods being used?,code_debt,low_quality_code
accumulo,1995,review,607994959,I think these error message would be more useful if they included the full path of the client props file that was used.,code_debt,low_quality_code
netbeans-website,473,review,430013474,Mmm.... infra will complain if we use jenkins builds as an update center. Also note this is extremely slow...,code_debt,slow_algorithm
kafka,7799,review,364476808,"We only needed it here because the we were trying to ensure we had a chance to send the Abort before going into poll. After thinking about it, it seemed a little simpler to move the `hasAbortableError` check to `maybeSendAndPollTransactionalRequest`. Then we no longer need this change.",code_debt,low_quality_code
spark,7181,review,33755269,how is this less code? It is just a bad idea to create unnecessary state. Just move both tables into two fields in Hex object.,code_debt,complex_code
spark,20787,review,175982564,"Hm, this should have been caught by Scala linter because we follow Java style comment. See ""Code documentation style"" in http://spark.apache.org/contributing.html",code_debt,low_quality_code
helix,1663,review,588774064,"This test should probably be named as TestZkClientAsyncFailureMetric since your new code is only adding metrics. The aync function should be already covered in existing tests. 
With that said, have you checked whether it's possible to only add metrics testing to existing tests by mocking the results? That would save us one additional test file. If there is no available code path or too many efforts involved, I'm fine with having a separate test too. But please check the zkclient and monitor test.",code_debt,low_quality_code
spark,3651,review,21697554,"OK, in the name of keeping it simple I might not touch this this time. Since this occurs 2 places only, it doesn't save much.",code_debt,low_quality_code
flink,9082,review,340395215,throw `IllegalArgumentException` or `UnsupportedOperatorException` makes more sense to me.,code_debt,low_quality_code
kafka,6363,review,278752888,This is getting a bit confusing -- this seems the same as `currentWorkerAssignment`. What mutates that causes this to be different?,code_debt,low_quality_code
flink,12268,review,430016877,"hmm, not sure. Maybe this happens because the JVM writes that to the STDERR. That's annoying :/
This is probably fine then; I was initially worried we might get so long filenames that you wouldn't be able to extract the logs on Windows.",code_debt,low_quality_code
iceberg,2167,review,571340787,"Nit: it would be nice to keep the expression on one line, wrapping after `checkArgument(`",code_debt,low_quality_code
spark,19460,review,143571046,I get declaring a constant though it doesn't just pertain to byte arrays. I couldn't find a good place for it. I don't know if its reused so much that it needs this,code_debt,low_quality_code
camel,3171,review,324231977,Maybe this at debug. Too noisy.,code_debt,low_quality_code
incubator-pinot,2068,review,149484084,"todo before release: 
Document this cp as what's it's doing is a little bit obscure",code_debt,low_quality_code
orc,570,review,528911518,Could you add `@deprecated` to give a proper warning?,code_debt,low_quality_code
spark,21200,review,185664585,"It's not okay catch and ignore all throwables. E.g. OOMs should NEVER be ignored as it leads absolutely unexpected situations.
At best, you can catch `NonFatal(ex)` and ignore those (only after logging as a warning). For other throwables, log as a warning, and rethrow.",code_debt,low_quality_code
attic-apex-core,479,review,108591304,"This method doesn't always create a new DeployRequest - can we name it appropriately? Say ""addOrModifyDeployRequest"" or ""getDeployRequestForContainerId"". By the way, would it be an error in some cases to find an existing DeployRequest for a given containerId? For example when you are calling this from StreamingContainerManager.scheduleContainerRestart(), wouldn't it be an error to find an existing request? If true, we should add code to detect such errors. The caller passes a parameter to indicate that only new request is expected to be created and so on...",code_debt,low_quality_code
spark,28952,review,447482241,"let's put `10` as a parameter, to make this method a bit more general.",code_debt,low_quality_code
storm,215,review,15836939,"We should remove Config.UI_ACTIONS_ENABLED, or at least deprecate it.",code_debt,dead_code
flink,12042,review,422441179,"in fact, the table qualified name may be long. in addition, we may need to add catalog name and database name to distinguish between tables with the same name.",code_debt,low_quality_code
qpid-dispatch,1097,review,608990009,"Can we drop ""Adaptor"" from this class name?  When I first read this I was assuming it was a set of tests that pertained only to the HTTP1 Adaptor.
Also should this class be a subclass of ""object""?",code_debt,low_quality_code
kafka,2405,review,97622033,Feels like this collection is redundant. You can get the name from `InternalTopicConfig` perhaps?,code_debt,complex_code
daffodil,408,review,488125346,"I think it would be more clear to just do string matching. E.g.
The regex just adds extra complexity. Same with setProperty.",code_debt,complex_code
kafka,6521,review,273258127,"Could you add a check to verify that the returned iterator is empty. Something along the lines of `assertThat(iterator.hasNext(), is(false))`?
Could you also add a test for a range query where the start key is equal to the end key? Such a unit test ensures correct behaviour for this special case.    
nit: I would rename the test to `shouldReturnEmptyIteratorForRangeQueryWithInvalidKeyRange`. Correct me, if I am wrong, but I think the empty iterator and the invalid key range are the points here, not the negative starting key. I would even change the range from (-1, 1) to (5, 3). It took me a bit to understand why (-1, 1) is an invalid range. 
These comments apply also to the unit tests below.",code_debt,low_quality_code
kafka,3575,review,129764370,Nit: should we include bytes like we did `ms` for the other case?,code_debt,low_quality_code
spark,7842,review,43212805,The curly braces are not needed. The same for the following `case` statement.,code_debt,complex_code
incubator-mxnet,10900,review,188720460,I would suggest to simply use `mx.image.imread()` and then call `.asnumpy()` before plotting. There shouldn't be a need of a dependency on `cv2` that way.,code_debt,complex_code
spark,15009,review,106230108,nit: move to previous line,code_debt,low_quality_code
drill,1251,review,187210052,I just removed this detail since we are saying these libraries are deprecated and we no longer want to use them.,code_debt,dead_code
airflow,12383,review,524536973,"I don't think we really need this -- with multiple webserver worker processes any refresh would lead to confusing state (some on new list, some on old, and no way to tell which is which) unless we have some way to make _all_ workers perform it.",code_debt,complex_code
kafka,5379,review,204563539,"Personally, I would get rid of this and use `extensionValue` and `extensionNames`. Otherwise, as @rondagostino said below, we should remove `extensionValue`.",code_debt,low_quality_code
flink,4851,review,145917513,"ad 1. - that's why I have used `StateAssignmentOperation.operatorSubtaskStateFrom`, to share this logic. I didn't want to use all of the `StateAssignmentOperation`, because it's constructor is really annoying to fulfil.
ad 2. - that's a valid concern, however writing ITCases for this might be also an overkill. And wouldn't it be to necessary to test it against every state backend, to make sure that there are no introduced quirks during (de)serialisation?",code_debt,low_quality_code
daffodil,291,review,348540375,"These ``_fileOS == null`` checks are kindof ugly. Thoughts on making this so this class just extends OutputStream instead of ByteArrayOutputStream, and then make it a wrapper for an output stream, which might change from ByteArrayOutputStream to FileOutputStream? I'm thinking something like:
Makes it so all the overrirde functions are basically just stream.whatever(), except for write which just calls the switch thing. Another benefit is once the switch happens, the old ByteArrayOutputStream can be garbage collected, whereas before it couldn't.",code_debt,low_quality_code
cloudstack,2578,review,225156473,"This message looks a little bit misleading, or am I mistaken?",code_debt,low_quality_code
spark,10993,review,51332430,"AFAICT, this is never used, so I removed it.",code_debt,dead_code
incubator-mxnet,12918,review,227170725,"Can you use something like this instead?
Otherwise it throws an uncaught exception on CPU only machines.",code_debt,low_quality_code
kafka,6536,review,275588869,"Well, my point is, that the check can be simplified. I don't think that `record.headers() == null` can be true; it's guaranteed that there is a headers object.
Not sure if we can simplify the second check. It iterators over the headers map and does String comparison to find a header with key `v` -- seems to be rather heavy.",code_debt,complex_code
spark,4363,review,24212525,nit: indent two spaces,code_debt,low_quality_code
spark,6959,review,33198256,"AFAIK we don't have a style guide for Java code, but I think we should put spaces after the casts.",code_debt,low_quality_code
arrow,9356,review,580411319,This cast is unnecessary since the `Sum` method already returns a `double`.,code_debt,complex_code
beam,3936,review,142818337,This will slow down this performance critical code.,code_debt,slow_algorithm
beam,8270,review,274875921,Seems it'd be worth factoring this out into a context (including the expansion service jar test above).,code_debt,low_quality_code
drill,520,review,106658488,"This ` <exclude>javax/**</exclude>` exludes validation-api as well. Therefore it should be deleted. 
To avoid including unnecessary libraries I decided to add:
`               <exclude>javax/activation/**</exclude>`
`               <exclude>javax/annotation-api/**</exclude>`
`               <exclude>javax/inject/**</exclude>`
`               <exclude>javax/servlet-api/**</exclude>`
`               <exclude>javax/json/**</exclude>`
`               <exclude>javax/ws/**</exclude>`",code_debt,low_quality_code
spark,23181,review,237952522,nit: `clone()`,code_debt,low_quality_code
flink,14839,review,586411292,Why `rethrow` as `RuntimeException`?,code_debt,low_quality_code
druid,2806,review,59071300,the default should be made a constant somewhere instead of being defined in multiple places,code_debt,low_quality_code
cassandra,730,review,485793488,"this is `Class.toString` which is harder to read for arrays, so did this so I could read the output without googling =D.
primitives and objects will normally have valid string names, but arrays will be like `J[` which require knowing what that means or googling it.",code_debt,low_quality_code
spark,5400,review,27923456,nit: spaces around `{`,code_debt,low_quality_code
airflow,2372,review,140193220,This is redundant.,code_debt,complex_code
nifi,914,review,75858615,"Might be able to create a utility method in the abstract class like `byte[] getRow(String row, String encoding)` since it looks PutHBaseCell and PutHBaseJson both need the same logic",code_debt,low_quality_code
carbondata,1321,review,138830621,"`null != sortScope` can be removed, it is checked inside `CarbonUtil.isValidSortOption`",code_debt,complex_code
arrow,467,review,109291184,"There's https://github.com/apache/arrow/blob/master/cpp/cmake_modules/FindPythonLibsNew.cmake, is one or the other made redundant by the other?",code_debt,complex_code
druid,50,review,2541441," Also, there's no need for the String.format(), preconditions will do %s interpolation for you (I realize the String.format()was there before, but let's take this chance to get rid of it).",code_debt,low_quality_code
phoenix,933,review,510479056,nit: 0L,code_debt,low_quality_code
airflow,11132,review,495856534,"Yea default values can be hardcoded.
And also agree that showing a precise message for the used config will be better",code_debt,low_quality_code
cloudstack,2058,review,139283005,"Fix indentations if you want to remove try-catch, also add a test?",code_debt,low_quality_code
iceberg,1793,review,553700047,Same with these other methods. Should these be primitives?,code_debt,low_quality_code
flink,13135,review,475413540,"We are no longer referring to field names here. Honestly I am not sure if the point makes sense with the `KeySelector` only. The way I read this point is tells you can use field names, which we discourage nowadays.
I'd rather remove the point whatsoever.",code_debt,complex_code
accumulo,1330,review,316892853,"Regarding this naming convention, should these be `*.bind.address` or `*.address.bind`? What do you think? `master.bind.address` reads more naturally, but `master.address.bind` supports logically grouping address-related configs in a configuration hierarchy, which can be better for parsing, and more easily incorporate future changes.
An example of a future change which could benefit from the `*.address.bind` form could include work that address an explicit public advertisement address, in the case of the bind address not being publicly reachable (in the case of more complicated networking setups, such as those on some cloud services' infrastructure):
Example:
I'm leaning towards the `<service>.address.<addressType>` naming convention, rather than the `<service>.<addressType>.address` convention that you currently have here, but am open to discussion... because naming is hard. What do you think?",code_debt,low_quality_code
spark,15237,review,90548133,"this seems a little more complicated than is really necessary for the what you're doing here.  couldn't you achieve the same thing by leaving the original code and changing the one line above the original to:
not exactly the same -- it also allows whitespace around the scheduling mode, but maybe a good thing?",code_debt,complex_code
lucene-solr,2229,review,562524364,"Would it be acceptable to reformat the code when such a demand appears, or after I'm finished with these improvements? These ""some people"" might never need to look into Hunspell code.",code_debt,low_quality_code
incubator-mxnet,15277,review,296085060,nit: add this blank line back in.,code_debt,low_quality_code
hbase,809,review,344314816,"nit: Always better to use parameterized logging for performance [1]. Here info is the default, so probably doesn't matter as much. 
[1] https://logging.apache.org/log4j/2.x/performance.html",code_debt,slow_algorithm
kafka,5885,review,236424422,Can we name this `transactionGenerator` for simplicity?,code_debt,low_quality_code
druid,10070,review,445155089,minor nit:mark return type as nullable,code_debt,low_quality_code
spark,4588,review,26089697,super nit: order. swap with import above.,code_debt,low_quality_code
spark,22960,review,231413853,I think we can just get rid of it. I can't imagine both functions are specifically broken alone in `selectExpr`.,code_debt,complex_code
spark,448,review,11813558,"Yeah, you are going to end up getting the same thing.  I'd say we drop this one and leave the other.  Right now it probably doesn't matter, but the other one is lazy and gives the optimizer a chance to possibly improve things before actually executing.",code_debt,low_quality_code
hudi,2127,review,499304054,we can reuse some code in this file by pulling the common structure into a helper function ?,code_debt,low_quality_code
flink,8446,review,285160885,"I think you are right that in order to break up the cyclic dependency we would need to decouple the `SchedulingResultPartition` from the `SchedulingExecutionVertex` (via the `ExecutionVertexID` for example).
I'm wondering how bad this cyclic dependency and the need for mutable state is, though. From a user's perspective, the existing interfaces are a bit easier and more convenient to use. On the down side, it makes the implementation a bit harder and harder to test in isolation. However, do we want to test the `Scheduling*` implementations in isolation? Moreover, you always have this problem in graph structures which have bidirectional edges or loops.",build_debt,under-declared_dependencies
spark,24807,comment,500879466,"I think the SparkSession.close() behavior is on purpose, and that's a coherent behavior (i.e. just don't shut anything down until you're done, and then everything shuts down). What's not consistent with that is maintaining some state in the session that can't be cleared. 
I think the ways forward are probably:
- A new lifecycle method like `clear()`? more user burden but at least provides _some_ means of doing cleanup without changing `close()`
- Figure out how to automatically dispose of those resources or not hold them
- Just change the behavior of session's `close()` to not shut down the context. Behavior change, yes, but perhaps less surprising than anything.
Eh, do people like @cloud-fan or @gatorsmile or @HyukjinKwon or @dongjoon-hyun have thoughts on this? I feel like reference counting is going to end in tears here eventually, but, it's not crazy",design_debt,non-optimal_design
spark,4593,comment,75540678,"I have the same concern as @dbtsai in his comment. Most consumers of this API will already be caching their dataset before the learning phase. Without user care, this will introduce effectively double caching (in terms of data size of cached RDDs) and will cause many jobs to fail after upgrading by exceeding available heap for RDD cache. Furthermore, we are making assumptions about how to cache -- in-memory only in this case. Should we parameterise this? Perhaps that will help send the message in the API that there is caching also done before learning. (FWIW, in-memory is definitely the right default choice here.)
See email thread on dev for my specific encountering of this bug: 
http://mail-archives.apache.org/mod_mbox/spark-dev/201502.mbox/%3CCAH5MZvMBjqOST-9Nr9k1z1rUODfSiczr_fV9kwqDFqAMNLC2Zw%40mail.gmail.com%3E",design_debt,non-optimal_design
spark,15148,comment,259376702,"I tend to agree that the terminology used here is a little confusing, and doesn't seem to match up with the ""general"" terminology (I use that term loosely however).
In my dealings with LSH, I too have tended to come across the version that @sethah mentions (and @karlhigley's package, and others such as https://github.com/marufaytekin/lsh-spark, implement). that is, each input vector is hashed into `L` ""tables"" of hash signatures of ""length"" or ""dimension"" `d`. Each hash signature is created by concatenating the result of applying `d` ""hash functions"".
I agree what's effectively implemented here is `L = outputDim` and `d=1`. What I find a bit troubling is that it is done ""implicitly"", as part of the `hashDistance` function. Without knowing that is what is happening, it is not clear to a new user - coming from other common LSH implementations - that `outputDim` is not the ""number of hash functions"" or ""length of the hash signatures"" but actually the ""number of hash tables"".
In terms of `transform` - I disagree somewhat that the main use case is ""dimensionality reduction"". Perhaps there are common examples of using the hash signatures as a lower-dim representation as a feature in some model (e.g. in a similar way to say a PCA transform), but I haven't seen that. In my view, the real use case is the approximate nearest neighbour search.
I'll give a concrete example for the `transform` output. Let's say I want to export recommendation model factor vectors (from ALS), or Word2Vec vectors, etc, to a real-time scoring system. I have many items, so I'd like to use LSH to make my scoring feasible. I do this by effectively doing a real-time version of OR-amplification. I store the hash tables (`L` tables of `d` hash signatures) with my vectors. When doing ""similar items"" for a given item, I retrieve the hash sigs of the query item, and use these to filter down the candidate item set for my scoring. This is in fact something I'm working on in a demo project currently. So if we will support the OR/AND combo, then it will be very important to output the full `L x d` set of hash sigs in `transform`.
My recommendation is: 
1. future proof the API by returning `Array[Vector]` in `transform` (as mentioned above by others);
2. we need to update the docs / user guide to make it really clear what the implementation is doing;
3. I think we need to make it clear that the implied `d` value here is `1` - we can mention that AND amplification will be implemented later and perhaps even link to a JIRA.
4. rename `outputDim` to something like `numHashTables`.
5. when we add AND-amp, we can add the parameter `hashSignatureLength` or `numHashFunctions`.
6. make as much private as possible to avoid being stuck with any implementation detail in future releases (e.g. I also don't see why `randUnitVectors` or `randCoefficients` needs to be public).
One issue I have is that currently we would output a `1 x L` set of hash values. But it actually should be `L x 1` i.e. a set of signatures of length `1`. I guess we can leave it as is, but document what the output actually is.
I believe we should support OR/AND in future. If so, then to me many things need to change - `hashFunction`, `hashDistance` etc will need to be refactored. Most of the implementation is private/protected so I think it will be ok. Let's just ensure we're not left with an API that we can't change in future. Setting `L` and `d=1` must then yield the same result as current impl to avoid a behavior change (I guess this will be ok since current default for `L` is `1`, and we can make the default for `d` when added also `1`).
Finally, my understanding was results from some performance testing would be posted. I don't believe we've seen this yet.",design_debt,non-optimal_design
fineract,1458,comment,718052221,"I just feel increasing timeouts won't cut it. Doesn't sound like a real solution. Unfortunately, I don't understand much about schedular jobs to have a proper say in this but I think we have some performance issues. Need to figure out how to deal with that.",design_debt,non-optimal_design
flink,938,comment,125751865,"Out of curiosity: why was it failing sometimes on Travis and not locally? And how did you discover this? From the program level logs?
Another thing that came to my mind: in the long run, do we need a more complex way of configuring the retry policy? In my understanding, the number of retries is fixed. I can see an issue for very long run programs, which fail once in a while, but operate normally most of the time -- then at some point they will fail because of the fixed number of retries.",design_debt,non-optimal_design
superset,5445,comment,457472346,"This PR fell in a crack. Let's revive it. Seems like the long term solution is not using WTForms at all as we rip out more of the MVC and FAB scaffolding over time.
So I get the `NULL` vs `''` problem with unique constraints not applying properly, but other than that, does it affect users directly? I'm guessing it may affect the filtering functionality in the CRUD list view UI?",design_debt,non-optimal_design
incubator-mxnet,3781,comment,260116824,@sxjscience Yeah this will cut out a lot of code in our framework that were just there to redundantly track tensor dims for the purposes of feeding them to Reshape layer. I'm very excited about this. A small increase in (optional) complexity in Reshape layer pays off with a large decrease in complexity in our framework code.,design_debt,non-optimal_design
parquet-mr,808,comment,672774756,"@shangxinli,
If we will agree on the extending of the schema with metadata is a good idea and as you said the serialization/deserialization is also required we need to change the format first. The schema objects in parquet-mr are only exist in the parquet-mr runtime. To have them serialized we need to convert this object structure to the thrift object structure defined in the format. If we don't have the new metatdata fields in the format we cannot serialize/deserialize them. So it is a much bigger topic. Also, I'd like to see this feature separated from the encryption as it would be general approach for storing metadata in the schema. Meanwhile, I am not convinced that we need to have such extension.
About the namespace prefix etc. I don't agree this is not user friendly. That's why I've suggested to implement a helper API so the user doesn't need to deal with the conf keys (and values) directly. 
@ggershinsky,
I don't agree we cannot have a meeting about this topic in terms of transparency. What we have to do is to document here about what we have discussed and what are the conclusions. Meanwhile, I am not sure if a meeting would help but I am happy to participate if anyone thinks otherwise.
Also, if we think we are getting stuck with this issue I would suggest involving other members of the community. Maybe draw their attention on the dev list about this PR or bring up the topic on the next parquet sync.",design_debt,non-optimal_design
