project,pull_number,pull_type,id,text,classification,indicator
activemq-artemis,2012,comment,380818801,"As noted my biggest concern is that message refs need to be as light as humanly possible as they’re all in memory and affects greatly the scaling.
I would personally prefer the refactor if needed, than take this hit. 
Especially as this is only needed by someone wanting to use this in a plugin. Which means everyone else has to suffer",design_debt,non-optimal_design
spark,1541,comment,49855865,"Instead of a ConcurrentHashMap, we should actually move it to a disk backed Map - the cleanup of this datastructure is painful - which it can become extremely large; particularly for iterative algo's.
Fortunately, most cases, we just need the last few entries - and so LRU scheme by most disk backed map's work beautifully.
We have been using mapdb for this in MapOutputTrackerWorker  - and it has worked beautifully.
@rxin might be particularly interested since he is looking into reduce memory footprint of spark
CC @mateiz - this is what I had mentioned about earlier.",design_debt,non-optimal_design
hawq,1321,summary,0,"Rewrite the tuple construct and consume work flow to improve the read and write performance in pluggable storage framework. To be specific, it uses virtual tuple in tuple table slot instead of heap tuple between storage and executor to avoid tuple data copy during query processing.
@huor @jiny2",code_debt,slow_algorithm
trafficserver,347,summary,0,TS-4038: Redundant `isdigit(b)` in `LogFormat::parse_escape_string,code_debt,complex_code
parquet-mr,227,summary,0,PARQUET-318: Remove unnecessary object mapper,code_debt,complex_code
tvm,1905,summary,0,[Relay][Test] remove redundant test cases in test_op_level4.py,code_debt,dead_code
spark,9682,summary,0,[SPARK-11719] [ML] Remove duplicate DecisionTreeExample under examples/ml,code_debt,duplicated_code
kafka,2937,summary,0,Also add tests and a few clean-ups.,code_debt,low_quality_code
spark,25048,review,300427664,"Thank you for investigating this, @HeartSaVioR .
The original logic looks not safe. Do you think if there is any other better way?",requirement_debt,non-functional_requirements_not_fully_satisfied
flink,14084,review,554882968,"Just not supported yet, the type TIME_STAMP_WITH_LOCAL_TIME_ZONE is rarely used. But I think we should both support them in this version.",requirement_debt,requirement_partially_implemented
incubator-doris,4925,review,528201502,I think `DEL_NOT_SATISFIED` is more safe. Or you'd better change DCHECK to CHECK,requirement_debt,non-functional_requirements_not_fully_satisfied
spark,31905,comment,811106021,"Regarding your questions:
Can you provide a common streaming use case where a non-event-base processing of metrics is useful? The `Observation` proposes a ""get me the metrics"" API that hides listeners and multi-threading. In streaming context, there are no finite metrics.
Can you elaborate on this, please? Do you mean an async `get`? Can you provide some pseudo-code on how to use the metrics async.
It is not thread-safe in a scenario where the action on the observed dataset is called in a different thread than where the metrics are retrieved. I'd say such a multi-thread driver process is not the general use case for batch processing. Even if, the proposed `Observation` API aims at hiding multi-threading complexity so that users can use `Dataset.observe` in single-threaded scenarios. Users that are experience with multi-threading have no problem in using the existing listeners approach. They are not the target user of this extension.
Agreed.",requirement_debt,non-functional_requirements_not_fully_satisfied
tomee,713,comment,734780620,"I gave it a try at https://github.com/rzo1/tomee/tree/TOMEE-2324-v2 but I am quite unsure if this is what we were talking about. Consequently, I dropped some FIXME/TODO questions.
For this reason, I didn't open a related (new) PR yet. Maybe you can have a look at it?",requirement_debt,requirement_partially_implemented
flink,10388,comment,561631987,"Thank for the PR @HuangZhenQiu , the PR overall looks good, can you also add the cases for Blink planner ? Even though the code path looks the same, we still need the tests to make sure the logic works correctly.",test_debt,lack_of_tests
cloudstack,1572,comment,253562333,"1. the current set of integration tests doesnt test the new functionality added in this PR. Its merely a check to see nothing else is broken.
2. when did we freeze? I skimmed through the mails didnt see anything about master frozen. I do not see any blocker defects for 4.10.0.0. The latest understanding I have is anybody can merge with required code LGTMs and a BVT run.
3. Which smoke tests are broken? Is it you environment issue you are talking about? If not, are these new or did we release 4.9.0 with these broken tests/features?",test_debt,lack_of_tests
incubator-mxnet,17808,comment,605590914,"We can get rid of WIN_GPU_MKLDNN tests altogether but that still leaves us with the flakiness of WIN_GPU as can be seen in these builds
For roughly same code of this PR & same windows AMI, below are the results so far
WIN_GPU | WIN_GPU_MKLDNN | Build Number | Link
-- | -- | -- | -- |
✖︎| ✔︎|15 | http://jenkins.mxnet-ci.amazon-ml.com/blue/organizations/jenkins/mxnet-validation%2Fwindows-gpu/detail/PR-17808/15/pipeline
✖︎| ✔︎| 14 | http://jenkins.mxnet-ci.amazon-ml.com/blue/organizations/jenkins/mxnet-validation%2Fwindows-gpu/detail/PR-17808/14/pipeline
✔︎|✔︎| 12 | http://jenkins.mxnet-ci.amazon-ml.com/blue/organizations/jenkins/mxnet-validation%2Fwindows-gpu/detail/PR-17808/12/pipeline
✔︎| ✖︎| 13 | http://jenkins.mxnet-ci.amazon-ml.com/blue/organizations/jenkins/mxnet-validation%2Fwindows-gpu/detail/PR-17808/13/pipeline
Ofcourse your tests on local have a different story to tell...",test_debt,flaky_test
kafka,6234,comment,462503916,"ping. it'd be good to get this in since it'll help with debugging tests that flake pretty consistently on jenkins (though we may also need some follow up to turn up logging output during tests, I think a bunch of modules don't even have logging turned on).",test_debt,flaky_test
geode,4189,comment,544634796,"CI is failing due to flaky test, for which I created ticket GEODE-7319, and proposed solution.",test_debt,flaky_test
incubator-mxnet,12768,comment,428218284,"See my comment in the issue, were you able to reproduce? Do you have some evidence to declare it as a flaky test?  Unless there's more data I would be against disabling this test with the information that we have so far to prevent lowering the quality bar.",test_debt,flaky_test
zookeeper,1614,comment,785912733,"using the link on the failed GitHub CI job (the one with label ""Details""), you can select ""Rerun Jobs"". But that would re-run all GitHub based CI jobs for this PR, and that potentially can cause more flaky tests. So I think this is good enough.",test_debt,flaky_test
spark,9297,review,46203981,"Also, is the only purpose of `sqlListener` to prevent multiple listeners from being created at the same time? If so, I think it would be better to use an AtomicBoolean so that we don't create another strong reference to a SQLListener, which might have a lot of internal state that could lead to memory leaks.",design_debt,non-optimal_design
spark,2907,review,19663363,Thanks for the much better solution. That works just fine.,design_debt,non-optimal_design
pulsar,43,review,80817924,"Here, to avoid creation of new ByteBuf we modify same DoubleByteBuf of the message with newly computed checksum.
However, while message creation if we see memory-leak then we create `SimpleLeakAwareByteBuf` or `AdvancedLeakAwareByteBuf` (based on `ResourceLeak Level`) instead   `DoubleByteBuf`. So, should we keep this check.",design_debt,non-optimal_design
beam,6981,review,233161421,"Regarding the operator as a whole and as discussed in the past, constraints are mostly inherited and would need to be addressed by refactoring the base. I'm not sure about the timing for this though, if it should wait until legacy runner goes away (there is still significant work for portable runner to become adequate replacement for Java pipelines).",design_debt,non-optimal_design
kafka,8105,review,379594069,When are we removing the entry upon task closure? If it never cleans up we could potentially have an ever-growing map.,design_debt,non-optimal_design
arrow,9626,review,587325457,"Does this mean that conversion could give the wrong results (in addition to being leaky)? If so, can you add a test showcasing that? (I believe you need the different chunks to be unequal...).",design_debt,non-optimal_design
activemq-artemis,2427,review,232558150,"It may have them from legacy someone put it there, but if you were designing a collections class, you'd design it in a fashion so it focussed just on the logic it needs to have. And any interaction needed is supplied generically, e.g. for your case, you;d need generic method: remove(Predicate<SimpleString> predicate). This is a collection class in reality so i apply the same rules of engagement..
If anything that field, the flag and the method check hasInternalProperties really should move up to CoreMessage, as its only used there. Doing that would mean you can still get your benefit as then the check stays in CoreMessage. 
This would really clean up TypedProperties to just having fields it really should only care for, keeping it clean.",design_debt,non-optimal_design
trafodion,644,review,73953757,Doesn't look like columnReference is used after this. Is this a memory leak?,design_debt,non-optimal_design
kafka,9318,review,495932581,"This check makes sure the code always stays in sync. However, if we can make great code reviews (like yours), this static check should be unnecessary :)
I will remove this painful check (to me also) in next commit.",design_debt,non-optimal_design
spark,9399,review,43590281,Let's add a comment?,documentation_debt,outdated_documentation
gobblin,2656,review,292076607,"The reason is I get rid of `this.dags.get(dagId);` and there's no reference to a `dag` associated with this `dagId`. So clean up has to happen before `remove`, or `dag` object won't be fetched. 
Will add comment to make it clear",documentation_debt,outdated_documentation
superset,8867,review,360617020,"It's not super clear here what this does or why you'd want to use this config element. I had to read a bit of code to understand it.
Then add a proper example with type annotation",documentation_debt,low_quality_documentation
kafka,386,review,43579299,"Rep @onurkaraman : `removeGroup` should always be guarded by the group lock inside the `GroupCoordinator`, while `getGroup` and `addGroup` are not since the group object is not available yet. I will make that more clear in the comments.
Rep @junrao : ack.",documentation_debt,low_quality_documentation
spark,20303,review,249798529,"I can answer that myself, the countdown stuff is useful to figure out if the computation has completed. Please add some doc here.",documentation_debt,outdated_documentation
calcite,782,review,209381477,"``
// below might change the type of the call (e.g. from nullable to non-nullable)
// however simplify(..) is allowed to return node with different type
// if the type should match, then `simplifyPreservingType` should be used",documentation_debt,low_quality_documentation
spark,29104,review,459576703,"nit: Should we add a comment here that lookupKey contains only a single column ? It will make understanding ""allNull"" easier.",documentation_debt,low_quality_documentation
couchdb,3015,review,488882226,"It was carried over from the old couch_replicator_scheduler_job.erl and then from couch_replicator.erl 
https://github.com/apache/couchdb-couch-replicator/commit/b48d7bdc49d107f33d96f08603006a1c9edc322f#diff-ba1cca81bdc216835256f72cc6a72fa5R374
Beyond that not sure about its origin. Technically it is possible, say, for a couch_replicator_auth plugin to link to a process that then exit normally so we end up in this part of the code and it won't be a worker, changes reader or any other known process in this module. So perhaps we should change to a comment indicating that instead of leaving the commented code in there?",documentation_debt,low_quality_documentation
nifi,4303,review,432322027,"This looks a little strange to my be retrospect, but the documentation says “To reduce the amount of time admins spend on authorization management, policies are inherited from parent resource to child resource”, so I think in practice the case where you cannot access the process group but you can access a resource within should not happen.",documentation_debt,low_quality_documentation
hive,2111,review,607667423,"Since it's a new interface method, can you add some javadoc please?",documentation_debt,outdated_documentation
hudi,2106,review,503737912,"please keep this javadoc to be just about the preCombine() method, without any context from this PR;s scenarios.",documentation_debt,low_quality_documentation
hadoop,575,review,264257746,"""if the stream is not in state Open"" would be clearer.",documentation_debt,low_quality_documentation
beam,6676,review,233138480,"Looks like doc was outdated, corrected it, batchSize controls elements used in batch INSERT SQL, i.e INSERT INTO t(a, b, c) VALUES(x1, y1, z1), ..., (xN, yN, yN); Batching can speed up loading data greatly, but not all SQL database may support it, so controlling batch size gives some lever for various SQL vendors.",documentation_debt,outdated_documentation
incubator-pinot,4387,review,300516190,Would be nice to add a comment on why TreeMap (ordering) is needed.,documentation_debt,low_quality_documentation
spark,1379,comment,71531266,@dbtsai I did batching for artificial neural networks and the performance improved ~5x https://github.com/apache/spark/pull/1290#issuecomment-70313952,code_debt,slow_algorithm
carbondata,4078,comment,787036665,"@VenuReddy2103
 I checked all places, but 14 places still keep the same with previous.
1) in 9 places, it uses only one event, fireEvent is ok. 
2) in 4 places, preEvent and postEvent are in the different code blocks.
3) in 1 place, there is a large code block between preEvent and postEvent.",code_debt,low_quality_code
spark,4533,comment,73925690,"Sounds correct. The subsequent tries do try in parallel. So, I suppose that's pretty good evidence it's parallelized. Unless anyone else speaks up I think this sentence can be removed.",code_debt,complex_code
arrow,4258,comment,490781968,"+1 lgtm
@liyafan82 , thanks for the contribution. I suggest you add a similar flag for isSet() to be optionally skipped in a separate jira to improve performance",code_debt,slow_algorithm
cxf,561,comment,498837564,"I'm wondering if it would make sense to insert a layer between AbstractFeature and the actual features like:  
and then each of the subclasses would look something like:
and a lot of the duplicate code in each of the subclasses goes away. 
Thoughts?",code_debt,duplicated_code
kafka,1908,comment,250894831,"LGTM. Merging to trunk and 0.10.1. Thanks @edoardocomar and @mimaison for the hard work (and patience) on this patch! I have some minor cleanups/improvements on the client and in testing, which I will submit in a follow-up PR.",code_debt,low_quality_code
zookeeper,1417,comment,665952705,"okay, so I'll have to fix a few checkstyle issues :)",code_debt,low_quality_code
iceberg,1669,comment,718305151,"In the case of a large amount of data, in order to ensure the performance of normal writing,
1. Should we use asynchronous Rewrite? (use AsyncWaitOperator)
2. Should you add a switch to control whether to  enable rewrite",code_debt,slow_algorithm
spark,28370,comment,628792196,Could you add the code to avoide the infinite retry loop on error & also checking thread interrupted incase something else swallows the thread interruption exception in the future?,code_debt,low_quality_code
skywalking,4987,comment,652475825,"local compile and package speed is so slow,because  need to download so much dependency jar file from maven depository",code_debt,slow_algorithm
tvm,4847,comment,584462639,CSourceModule with an empty string looks to me as well. @kumasento could you do that instead of creating a dummy llvm module? Thanks.,code_debt,low_quality_code
airflow,1488,comment,222606343,Ah. The hive-hook shouldn't be there. I think I must have included it from someone elses commit when doing a rebase. Will tidy it up and do a force push later today.,code_debt,low_quality_code
trafficserver,2300,comment,318132384,"It seems possible to collapse at least some of this class hierarchy, but I was told that there's future plans for making subclasses of the PrinterIface class. There just seems like a lot of class hierarchy (up to 4) for such a small amount of code, and I really don't think we should make provisioning now, for something that *might* be done later. If it becomes an issue later, it's easy to refactor (don't do premature ""abstractions"" :-).",code_debt,low_quality_code
spark,224,comment,38748839,"Hi Cheng Hao,  Thanks for implementing these functions.  I bet they will be much faster than using HiveUDFs as we do now!
Based on the number of comments on the test case refactoring, I think it would be easiest to try and commit just the LIKE and RLIKE with a few simple test cases, and then take on the rest in a separate PR.",code_debt,slow_algorithm
kafka,4001,comment,333581688,Am I missing something or you're using raw types in several places now? Raw types only exist for migration compatibility purposes and should never be used in new code IMO.,code_debt,low_quality_code
nifi,3260,summary,0,NIFI-5790 removed the last test as it's causing a race condition intermittently,test_debt,flaky_test
ignite,4970,summary,0,9769 test flakiness,test_debt,flaky_test
druid,1899,summary,0,Docs improved: more details about caching and memory for segments on historicals,documentation_debt,low_quality_documentation
tvm,1716,summary,0,[NNVM][KERAS] Fix keras model converter and improve tutorial,documentation_debt,low_quality_documentation
dubbo,2520,summary,0, typo: leastIndexs->leastIndexes,documentation_debt,low_quality_documentation
zookeeper,567,comment,405419213,Thanks for the review @anmolnar. Please take a look at unit tests when you get a chance. I have addressed the comments. I will also add documentation in a separate commit.,documentation_debt,low_quality_documentation
carbondata,3136,comment,468114436,"@tianyouyangying +1 for @qiuchenjian 's suggestion.
1. Please change all chinese to english.
2. Please change PR title to '[HOTFIX][DOC] Fix the format of SQL in dml-of-carbondata.md to avoid ambiguity'
@qiuchenjian The origin SQL in doc actually are two statements, we should seperate them to avoid ambiguity.
Thanks.",documentation_debt,low_quality_documentation
gobblin,104,comment,95396477,LGTM barring the typo,documentation_debt,low_quality_documentation
skywalking,5293,comment,673764279,Really detected one besides the mock. You need some fix on the doc this time. :),documentation_debt,low_quality_documentation
skywalking,5685,comment,711190648,"@wu-sheng  thx for check the structure this time.  If this version looks good, I will modify the doc and add the unit test later.",documentation_debt,outdated_documentation
druid,6230,description,0,"This patch includes the following bug fixes:
- TopNColumnSelectorStrategyFactory: Cast dimension values to the output type
  during dimExtractionScanAndAggregate instead of updateDimExtractionResults.
  This fixes a bug where, for example, grouping on doubles-cast-to-longs would
  fail to merge two doubles that should have been combined into the same long value.
- TopNQueryEngine: Use DimExtractionTopNAlgorithm when treating string columns
  as numeric dimensions. This fixes a similar bug: grouping on string-cast-to-long
  would fail to merge two strings that should have been combined.
- GroupByQuery: Cast numeric types to the expected output type before comparing them
  in compareDimsForLimitPushDown. This fixes #6123.
- GroupByQueryQueryToolChest: Convert Jackson-deserialized dimension values into
  the proper output type. This fixes an inconsistency between results that came
  from cache vs. not-cache: for example, Jackson sometimes deserializes integers
  as Integers and sometimes as Longs.
And the following code-cleanup changes, related to the fixes above:
- DimensionHandlerUtils: Introduce convertObjectToType, compareObjectsAsType,
  and converterFromTypeToType to make it easier to handle casting operations.
- TopN in general: Rename various ""dimName"" variables to ""dimValue"" where they
  actually represent dimension values. The old names were confusing.
* Remove unused imports.",build_debt,over-declared_dependencies
geode-native,56,description,0,"- section title is Interoperability of Language Classes and Types
- corrected namespaces (packages)
- removed duplicate table captions
@davebarnes97 @joeymcallister @dgkimura @mmartell @echobravopapa @PivotalSarge Can you please review these (mostly namespace) changes in the docs?",code_debt,duplicated_code
madlib,243,description,0,"JIRA: MADLIB-1206
This commit adds support for mini-batch based gradient descent for MLP.
If the input table contains a 2D matrix for independent variable,
minibatch is automatically used as the solver. Two minibatch specific
optimizers are also introduced: batch_size and n_epochs.
- batch_size is defaulted to min(200, buffer_size), where buffer_size is
  equal to the number of original input rows packed into a single row in
  the matrix.
- n_epochs is the number of times all the batches in a buffer are
  iterated over (default 1).
Other changes include:
- dependent variable in the minibatch solver is also a matrix now. It
  was initially a vector.
- Randomize the order of processing a batch within an epoch.
- MLP minibatch currently doesn't support weights param, an error is
  thrown now.
- Delete an unused type named mlp_step_result.
- Add unit tests for newly added functions in python file.
Co-authored-by: Rahul Iyer <riyer@apache.org>
Co-authored-by: Nikhil Kak <nkak@pivotal.io>
Closes #243",code_debt,low_quality_code
cloudstack,1295,description,0,"Added quotes to prevent syntax errors in weird situations.
Error seen in mgt server:
Cause:
Somehow a nic was missing.
After fix the script can handle this:
The other states are also reported fine:
While at it, I also removed the INTERFACES variable/constant as it was only used once and hardcoded the second time. Now both are hardcoded and easier to read.
This is the same as PR #1249 except it is against `4.7`.",code_debt,low_quality_code
superset,5946,description,0,"- Remove `lodash.throttle` from dependency since there is now `lodash`.
- Add `babel-plugin-lodash` that helps optimize bundle output by taking only necessary part from lodash instead of the entire bundle.
https://github.com/lodash/babel-plugin-lodash
- Replace `underscore` calls with `lodash` where applicable. 
@williaster @xtinec @conglei",code_debt,complex_code
flink,4426,description,0,"Remove unnecessary include-elasticsearch5 profile since its activation condition (usage of jdk8) is always true.
Run any mvn command in `flink` or `flink-connectors` and check that the reactor includes ES5.",code_debt,dead_code
