project,pull_number,pull_type,id,text,classification,indicator
systemds,204,review,73768209,Would you want to check if sc is a SparkContext instance to raise a more meaningful error?,code_debt,low_quality_code
incubator-heron,81,review,51090091,Can we get rid of this?,code_debt,low_quality_code
spark,8744,review,39581040,`en` is unused.,code_debt,dead_code
spark,27612,review,380444937,"~nit. If possible, can we have additional test statements for `minute` and `second` together below line 743 to make it sure?~
Never mind. I missed the other PR which landed already on `branch-2.4`.",code_debt,low_quality_code
flink,6173,review,196042694,"We have unmodifiable map alternatives in the JDK. If there is not a good reason why we need guava here, I would suggest to solve this without this import. Even in that case, I would use import and not fully qualified classname.",code_debt,low_quality_code
guacamole-client,122,review,161413980,"If this is an upper limit, I would suggest something like `radius-max-retries` to make this more clear.",code_debt,low_quality_code
spark,15963,review,88906249,Nit: the second brace and its match are redundant,code_debt,complex_code
kafka,3662,review,132859349,"I tried breaking up the new test method in `WorkerSinkTaskTest` into multiple methods, but it actually just made it harder to read.",code_debt,low_quality_code
arrow,2890,review,230019538,There's some other cruft here that ought to be removed. I'll make some additional changes and then merge this,code_debt,dead_code
flink,7759,review,258458285,"consider converting the following conditions to methods, this would assign a name to the condition, and possibly would make it a bit easier to test.",code_debt,low_quality_code
spark,30204,review,516533952,nit: Can we unify this with `createYarnResourceForResourceProfile` in YarnAllocator ?,code_debt,low_quality_code
beam,1706,review,95843283,"This worries me.
I'm ok with having the tests run with `Parameterized`, but if we do so we should still be able to determine which case we're in and set the expected exception per-test within the test based on the value of the parameters, rather than inspecting the name of the test. For example, `testConflict_runnableOnServiceAnnotation_expectIllegalStateException` doesn't demonstrate by reading the test code directly that it expects an exception.",code_debt,low_quality_code
incubator-pinot,5700,review,459633576,"Unused, please remove",code_debt,dead_code
airflow,12096,review,517611582,"It's a more efficient way to get the last item from a generator - no need to iterate over every item from the generator just to get to the last one.
It might make a difference in case of lots of events.",code_debt,slow_algorithm
hadoop,1881,review,388858948,nit: this line is long enough its time to split,code_debt,low_quality_code
reef,1054,review,68419655,This looks 100% the same as in the local runtime. Can we reuse that code instead of duplicating it?,code_debt,duplicated_code
spark,23062,review,234404871,Spacing here. Is this simpler with .forall?,code_debt,low_quality_code
spark,158,review,11264777,"Instead of doing this, just prevent users from creating a StorageLevel with offHeap = true and replication = 1. Add a check in the StorageLevel constructor and throw an exception if they make one. Otherwise nobody will understand why this code was added here.",code_debt,low_quality_code
spark,1218,review,15828037,"@mridulm yes I'm aware of that. But before, SparkContext was using reflection to instantiate two different classes in the yarn package, and then connect them manually. I removed one of those (see that there's still reflection code to load `YarnClusterScheduler`) because it seemed unnecessary.",code_debt,dead_code
incubator-mxnet,15371,review,302817980,Get rid of dead code or un-comment to add coverage.,code_debt,dead_code
nifi-minifi-cpp,1040,review,605509404,"minor, but `org::apache::nifi::minifi::` is not needed
in a few other places, too, `org::apache::nifi::minifi::utils::StringUtils::toBool(...)` could be shortened to `utils::StringUtils::toBool(...)`",code_debt,dead_code
spark,25626,review,320095359,"nit: we can use multiline string, e.g.",code_debt,low_quality_code
systemds,740,review,172401453,use `new MatrixBlock(((ScalarObject) newOutput).getDoubleValue())` instead.,code_debt,low_quality_code
flink,11047,review,379996777,Can we introduce a `TableSinkFactoryContextImpl` class to reduce so many anonymous classes?,code_debt,low_quality_code
beam,13137,review,522334301,Maybe you also need to add null checks in process... up to you.,code_debt,low_quality_code
nifi,1036,review,81411506,"Not an incredibly big deal, but getSupportedPropertyDescriptors() is called very often (most often in validation during a UI Refresh) which causes lots of ArrayLists to be created.  I prefer the way DistributeLoad handles this, by creating one ArrayList and reusing it, while also using an AtomicBoolean to know when it should be recreated.",code_debt,low_quality_code
hive,550,review,343202348,yeah...this seems to be one place where this tablename git confusing ... :+1:,code_debt,low_quality_code
carbondata,3584,review,389603171,"Suppose to be && instead of || ?
line 123: 
boolean usePartitionInfoForDataMapPruning = table.isHivePartitionTable() && filter != null && !filter.isEmpty() && partitions != null
and use the same flag to reset in line 138, it is confusing now",code_debt,low_quality_code
brooklyn-server,835,review,142912453,"TL;DR: I agree this is fine. Below are some notes from digging around in the synchronization code.
Looking at the other synchronization blocks, `emitInternal` will synchronize on `EntityManagementSupport` instance (when it calls `getSubscriptionContext()`. It will then call `publish` which will synchronize on `LocalSubscriptionManager` instance (in `getSubscriptionsForEntitySensor`).
However, I think we can trust both the `EntityManagementSupport` and the `LocalSubscriptionManager` to not call out to alien code while holding a lock on itself. Therefore we should be safe in that respect.
The code in `AbstractEntity` and `AbstractGroupImpl` looks a bit scary, where it first gets the lock on this `values` object and then on either `abstractGroup.members` or `abstractEntity.children` (but it's kind-of understandable why it does that and how that pattern avoids it; it would just be nicer if instead we didn't call out to alient code while holding the lock on `values` - but that's a bigger discussion than for this PR):",code_debt,low_quality_code
spark,15627,review,85951050,"If we can cleanup the variables names above I think it would help a lot, the test is confusing.  I know you just copy and pasted but would be nice to clean up.
Also can we have 3 tests or 3 asserts,  
- one for same file in --files
- one for same file in --archives
- one for same file in --files and --archives",code_debt,low_quality_code
ignite,8048,review,480182091,Bad formatting.,code_debt,low_quality_code
spark,1222,review,15478958,"We shouldn't remove this... This is intended to be a general purpose class for logging that handles compression and buffering and other logic. I notice that you replaced this with PrintWriter elsewhere. Even with the new naming scheme you can still use this class for event logging, and it will simplify `EventLoggingListener` a bunch.",code_debt,low_quality_code
spark,31296,review,562868528,"This sounds a little risky to me, `A process is invoked even for empty partitions`.
This may cause a hang situation if the command is expecting input.
For example, this PR's test case is using `cat`. And, `cat | wc -l` hangs.
If we are okay, could you add a test case of empty partition to make it sure that we handle those cases?",code_debt,low_quality_code
dubbo,3162,review,245860102,"Personally think that this place is worth discussing. Most of the exceptions have been handled in connect and disconnect, and there is a log. I think the log here can be removed.",code_debt,low_quality_code
spark,22154,review,234385204,"The suggested change is only for making this test suite cleaner, right? In that case I'd +1 with the suggestion of being able to clearly check we're catching the exception we know we're throwing.
Would you like to submit a PR for it?
The intent is never to actually reach the null-return, but always cause an exception to be thrown at `CodeGenerator.compile()` and abruptly return to the caller with the exception. To make the compiler happy you'll have to have some definite-returning statement to end the function, so a useless null-return would probably have to be there anyway (since the compiler can't tell you'll always be throwing an exception unless you do a throw inline)",code_debt,low_quality_code
ignite,7851,review,430399878,"It is not correct javadoc ""list"", it should be written in HTML style like
So, it is a test though... who cares.",code_debt,low_quality_code
flink,12900,review,454415036,"Is this interface really necessary? Especially with `@PublicEvolving` annotation? How are users supposed to use it? If I understand it correctly you need it for internal operations. Moreover you need it because the `WrapperTypeInfo` is in `blink-runtime`, right?
Can't we move the `WrapperTypeInfo` to the `table-common` instead?  The class itself has no runtime dependencies. Only the factory methods need some runtime classes.",code_debt,complex_code
flink,12176,review,426165664,do not need `ifPresent`,code_debt,complex_code
gobblin,1106,review,70877402,"Is there any reason to `catch Throwable`, instead of specific exceptions?",code_debt,low_quality_code
spark,20194,review,161000312,"Impala is the only reference I can find https://www.cloudera.com/documentation/enterprise/5-10-x/topics/impala_show.html
To be consistent with the other SHOW function, we can make LIKE optional?",code_debt,low_quality_code
spark,21476,review,192476723,"This is so specific to the way YARN runs things that I don't think it would be useful anywhere else. If at some point it becomes useful, the code can be moved.
I think the tests I added are better than just unit testing this function, since that way the code is actually being run through YARN and bash.",code_debt,low_quality_code
openwhisk,4031,review,255882825,Note that the `namespace` and `action` would remain same for all test. Though we do a cleanup after each run it may be better to use different name for each test run,code_debt,low_quality_code
incubator-pinot,4777,review,344013968,"try to make comparisons more specific. Since you know there are only 2 parts and parts cannot be negative, avoid the ""less than"" comparison and instead use `parts.length != 2`",code_debt,low_quality_code
druid,3928,review,106563776,"formatting, new lines would be easier to read",code_debt,low_quality_code
ozone,1503,review,506851310,Can we reuse an existed method OzoneFSUtils#addTrailingSlashIfNeeded(keyName) instead of?,code_debt,low_quality_code
spark,28038,review,402528402,"Yes. Talking with @dbtsai he wanted to add a lock on the blocks inside of `doCleanupShuffle`, but given that the only price is duplicated messages to the executors I'm not sure its worth the overhead of keeping track of that many locks.",code_debt,low_quality_code
spark,4690,review,25098634,"I think we can back that out if there's any question to keep this limited. @JoshRosen Yes that's where we ended up again, now that it's clear that there are several ways and several places this can happen. It's easiest just to ignore the exception.",code_debt,low_quality_code
trafficcontrol,3601,review,297263939,"maybe just add a ""finally"" instead of a ""then""?",code_debt,low_quality_code
apisix-dashboard,979,review,543388564,hard code is not a good way,code_debt,low_quality_code
spark,5355,review,28042923,`np.uint64` -> `np.int32` (to be consistent with Scala implementation),code_debt,low_quality_code
incubator-heron,1820,review,113760959,Is this the implementation class? If so can we use `class` instead of type to be more explicit?,code_debt,low_quality_code
beam,92,review,58796896,"This particular test (and probably others in this file) could be made runner-agnostic. That would make them much better.
However, this is an underlying problem here. Ok to ignore for now.",code_debt,low_quality_code
flink,14734,review,569501903,nit: one step further would be to store `CheckpointBrief` in `PendingCheckpoint` instead of collections. But that's probably out of scope of this PR,code_debt,low_quality_code
kafka,5068,review,191512386,Do we actually want this to be `Long.MAX_VALUE`? Seems error prone since the normal thing to do with the TTL is add it to the current time and that will cause overflow. Should we have some sentinel value for infinite TTL?,code_debt,low_quality_code
spark,9193,review,42587435,"nit: this is kinda hard to read with the double negatives. consider:
?",code_debt,low_quality_code
incubator-doris,5219,review,559096882,better to add the value of max journal id and image id in response msg for easy debugging.,code_debt,low_quality_code
drill,1892,review,363140288,"You probably *really* don't want to do this. Converting the response to a string causes the client to download the **entire** response to memory, then convert it to a Java string. Doing so completely negates the disk-based buffering that seems to be implemented below.",code_debt,low_quality_code
calcite,2369,review,593096896,"Makes sense. I removed these assertions completely, as they are unrelated to the fix. Also added comments to the tests.",code_debt,low_quality_code
hadoop,802,review,291163702,nit: stick at the top (line 20) with the gab above the org.apache stuff. We can at least try to not make import ordering worse,code_debt,low_quality_code
kafka,3325,review,128649545,"Instead of using this separate class and do the `instanceof` check on each call (which maybe expensive), maybe we could just have a `WrappedBatchingStateRestoreCallback` which only takes the non-batching `StateRestoreCallback` in constructor and then in `restoreAll` always do the for-loop, and in places that we need it (seems we only have two callers) we can do sth. like
Just once.",code_debt,low_quality_code
spark,15971,review,89209660,"This is pretty hacky. It makes assumptions about how things are formatted in the event log.
The previous assert should be enough (ignoring my previous comment about changing this test).",code_debt,complex_code
lucene-solr,1303,review,387662567,"This is fine with me but FWIW I wouldn't even bother defining it.  It has no value set aside like this; I doubt any user code would want to refer to it.  If we want to document what the default cost is, we should say so in cost()'s javadoc.  I know some devs like to make static constants for everything but IMO it's sometimes wasted ceremony.",code_debt,complex_code
superset,10728,review,479692093,"nit: commented out code bothers me. It's in a storybook, though, so I won't strongly object.",code_debt,low_quality_code
spark,19911,review,155335791,"@dongjoon-hyun to be clear, I think there are 2 problems:
1. The PostgresDialect indicates that `CASCADE` is enabled by default for Postgres. This isn't the case as the Postgres docs show. 
2. As you correctly mention (this is what in my previous comment), Spark doesn't use `CASCADE` at all, which, especially considering the method this PR edits, is a bit odd I think. I plan to open a different JIRA ticket for this, and add it. This will be more work, and is outside the scope of the current JIRA.",code_debt,low_quality_code
druid,1265,review,27927153,"Aren't 1, 2 and 4 the same as the 1, Shorts.BYTES and Ints.BYTES from the part above?
This code is really confusing me...",code_debt,low_quality_code
cassandra,711,review,472502571,"nit: better to do `node1.nodetoolResult(""disableautocompaction"", ""netstats_test"").asserts().success();` rather than exec into the instance.",code_debt,low_quality_code
ozone,1233,review,482676002,"need space before ""+""",code_debt,low_quality_code
druid,3939,review,102355893,Use log message formatting `%d`,code_debt,low_quality_code
spark,29795,review,493190061,nit: use local variable if possible,code_debt,low_quality_code
druid,5418,review,179293634,"Removed `reportParseExceptions` here, it should always be true (always thrown, handling depends on config)",code_debt,low_quality_code
kafka,7984,review,372683286,As above. Simplify to:,code_debt,complex_code
spark,19763,review,152914613,"After rethinking about this, I think it is better to indicate this threshold also determines the number of threads in parallelism. So it should not be set to zero or negative number.",code_debt,low_quality_code
kafka,2929,review,113856373,remove. this import already exists.,build_debt,over-declared_dependencies
spark,228,comment,39641216,"Hi, @pwendell , Thank you for your comments, here is my reply
First, ""whether accumulator value should be subject to change in the case of failure""...I think no, though during a long period, Spark runs in this way (this patch is actually resolving a very old TODO in DAGScheduler.scala)...I think accumulator is usually used to take the task which is more complicate than rdd.count/rdd.filter.count (Maybe I'm wrong), e.g. counting the sum of distance from the points to a potential center in K-means (see mllib), I think in this case, the health status of the cluster should be transparent to the user, i.e. the final result of K-means should be irrelevant to whether executor is lost, etc....
Second, Good point, I can understand what the use scenario is, but do you mind providing more details like how to implement this in Spark? I guess this can be solved by providing a approximateValue API in Accumulator or SparkContext....
Third, actually, this patch ensures that the value of the accumulator in a stage will only be available when this stage becomes independent (means that no job needs it any more, https://github.com/apache/spark/pull/228/files#diff-6a9ff7fb74fd490a50462d45db2d5e11L400), if a job finishes, and the other job still needs the certain stage, the accumulator value calculated in that stage will not be counted...",design_debt,non-optimal_design
beam,10227,comment,558882339,"We should still get rid of setup_requires, but this just might not be the _complete_ solution.",design_debt,non-optimal_design
storm,1480,comment,226404728,"@abhishekagarwal87: Ok, didn't spot that. Was only looking for ""guava"" relocations.
So, the dependency could be additionally included relocated into storm-redis. Or is it possible to use the already relocated package which is provided via storm-core? This would save some resources. I'm not very experienced with the `maven-shade-plugin` yet, unfortunately.
What is preferred?",design_debt,non-optimal_design
incubator-heron,3479,comment,626232335,"One ""short term workaround""™ for getting the `pex_pytest` to work was to change it so the pex binaries+tests defaulted to be non-zip safe so they are extracted. There were still failures later, which I think is from pex_library consumption. I'll see if I can patch that too, then hopefully come up with a neater solution for all of the issues",design_debt,non-optimal_design
druid,2231,comment,173443345,"Actually , looking at com.alibaba.rocketmq.common.ServiceThread from http://grepcode.com/file/repo1.maven.org/maven2/com.alibaba.rocketmq/rocketmq-common/3.2.6/com/alibaba/rocketmq/common/ServiceThread.java/ it looks like ServiceThread does a lot of synchronization and notifying on itself. That makes this impl much harder to review without an intimate understanding of ServiceThread.
Regarding testing, The general recommendation if the framework does not have a unit-test friendly tool, is to use EasyMock to force the behaviors you are testing for.",design_debt,non-optimal_design
spark,25651,comment,534813380,"@rdblue yea it's possible. In this PR, I try to adopt your suggestion to make it clear that `TableProvider.getTable` should take all the table metadata, so the method signature becomes
`TableProvider` has another `getTable` method which needs to infer schema/partitioning, and previously the method signature was
To make it consistent, I change it to use `properties: Map[String, String]`, also rename it to `loadTable` since we need to touch many files anyway.
We can still keep the old method signature with a TODO to change it later, so that this PR can be much smaller.",design_debt,non-optimal_design
spark,25785,comment,531497209,"I see, can that thread be a daemon? If System.exit is viable (i.e. immediately stopping daemon threads) then it should be. But if not, then yeah such a thread needs to be shut down cleanly somehow during the shutdown process. This could be a shutdown hook.",design_debt,non-optimal_design
spark,30392,comment,729168362,"I think so. In some cases, unnecessary executor-side reduce might invoke an additional map task although it just returns the single element. So this is just a minor concern for me.
The other thing is, `takeOrdered` is introduced into RDD API earlier than `treeReduce`. So I guess we may not consider to use `treeReduce` in this place before. For the nature of `takeOrdered` that sequences of elements are collected to the driver and reduced. It sounds a good fit for `treeReduce` as we can partially reduce before collecting to the driver. There is an overhead but sounds like a trade-off. Driver side usually a bottleneck for such case. The driver-side reduce is not parallel and also bound to local memory for all data.
I'm totally okay to close this if it doesn't sound good direction to go.",design_debt,non-optimal_design
cloudstack,4448,comment,724618330,@ravening I don't see the probably with requiring an internal DNS entry.  The operator can always enter the external DNS IP for it if they need to.  I can only see this causing pain elsewhere in the code.,design_debt,non-optimal_design
storm,1781,comment,262494323,"That should do it - the batching option has been removed from MapState, in favor of parallel processing with existing opaque and transactional logic to handle consistency. Cassandra batch statements are more trouble than they're worth.",design_debt,non-optimal_design
superset,12626,summary,0,docs: Updates to Superset Site for 1.0,code_debt,low_quality_code
arrow,6103,summary,0,ARROW-7473: [C++][Gandiva] Improve error message for locate function,code_debt,low_quality_code
carbondata,2878,summary,0,[CARBONDATA-3107] Optimize error/exception coding for better debugging,code_debt,low_quality_code
zookeeper,1328,summary,0,Extra horizontal lines,code_debt,low_quality_code
hbase,2167,summary,0,HBASE-24791 Improve HFileOutputFormat2 to avoid always call getTableRelativePath method,code_debt,low_quality_code
trafodion,115,summary,0,"Adding .rat-excludes, readme for rat and remove unneeded files lacking copyrights.Also hive/TEST009 fix.",code_debt,dead_code
tinkerpop,712,review,140818483,"Even though `Bindings` is based on a `ThreadLocal<T>` instance, I think the implementation is not thread-safe.
For example: Multiple tasks executed serially on the same thread, modifying the same bindings dictionary.
Besides not being thread-safe, it doesn't support defining a binding on 1 thread and adding the step on another, sample:",requirement_debt,non-functional_requirements_not_fully_satisfied
storm,2241,review,129494647,"Looks like you're removing max spout pending and also configuration for backpressure. Does this patch also touch the mechanism of backpressure?
And let's address this in patch or file an issue and remove TODO.",requirement_debt,requirement_partially_implemented
incubator-mxnet,9552,review,176825148,"Just tried. That function for FP32 convolution seems not implemented appropriately. The data member `layout` of struct `ConvolutionParam` is a `option<int>` type, but it was used with the assumption that `layout` contains a real value in that function. This will cause my test case to fail. Making that function properly implemented needs another PR. For now, I will just keep the shape inference for quantized_conv op. Already deleted the TODO comment.",requirement_debt,requirement_partially_implemented
nifi,71,comment,130314880,"Why is propertyMap marked volatile?  The value is only ever set once at construction time.
If the answer is because of thread safety, the contents of the HashMap are not ""protected"" just because the reference to the map is marked volatile.  puts/gets to the map do not inherit the memory barrier protections associated to the volatile reference.  c.f.  http://stackoverflow.com/questions/10357823/volatile-hashmap-vs-concurrenthashmap
Maybe a review of the concurrency issues of this processor is in order before accepting this merge request?  I'm pretty sure that, even though the class will mostly behave correctly since values are set during OnScheduled and OnStopped, these are not ""safely published"" to the map.  While unlikely, other threads could potentially see stale values in this map.
Either this class should likely be using ConcurrentHashMap here, or it should republish an entirely fresh map by calling ""new HashMap()"" instead of ""clear()"".",requirement_debt,non-functional_requirements_not_fully_satisfied
flink,439,comment,76031299,"I like the idea - that means that the webfrontend now shows what values are actually used, even if they are not in the config.
To make it even nicer, it would be cool to:
- Show which values come from the config (top) and show for which ones what default is used (in a second section below)
- add a Unit test that checks that all keys from the `ConfigConstants` are converted. I think it is easy to check this via enumerating all fields in the class using reflection.",test_debt,lack_of_tests
helix,1447,comment,704707243,"minor: suggest to change the PR (commit) title to ""Replace Thread.sleep() with TestHelper.verify() to fix the flaky unit tests"".",test_debt,flaky_test
