project,pull_number,pull_type,id,text,classification,indicator
spark,19143,comment,327427666,"You haven't actually added tests, and that's not all this PR does. At the least, this doesn't match the intent you describe, and should be closed. I'd back up and describe the test you want in the JIRA.",test_debt,lack_of_tests
kafka,8402,comment,609450055,test this please,test_debt,lack_of_tests
flink,5901,comment,387376186,"By the way, the test still doesn't catch the bug that you're fixing (https://issues.apache.org/jira/browse/FLINK-8286). I think we need proper end-to-end tests that really test Flink-Kerberos integration on an actual YARN cluster. I have started looking onto using Docker Compose for that, i.e. bringing up a hadoop cluster in docker with Kerberos and then running Flink on that as an end-to-end test.",test_debt,low_coverage
druid,3788,comment,268051850,"@erikdubbelboer ok that makes sense.
Can you please:
1. Add a comment to the code as to why this does not use `_`
2. Add unit tests to verify functionality.",test_debt,lack_of_tests
incubator-heron,3032,comment,437498318,"Overall is ok for me. 
**IT** coverage will be useful so i will be addressing through #3106",test_debt,low_coverage
zeppelin,2706,comment,353205540,@zjffdu can u confirm it's a flaky test?,test_debt,flaky_test
incubator-pinot,5769,review,467200428,"I think both ways have some pros and cons. I personally think that using a single endpoint is easier for users?
* The main purpose of online AD endpoint is to provide a convenient way to run AD tasks so the endpoint should be as simple as possible. Using a single endpoint is more user-friendly. Using a separate CRUD endpoint does allow more flexibility but it will ask users to firstly register their data before using this service.
* Secondly, online service will not allow much too large size of data so in my sense, sending data in the request every time is not a bottleneck?
I think we could provide both ways. This is phase 1 for this feature. In phase 2, we probably could support another two endpoints to support what you suggested. 
Regarding the cleanup, I think currently in phase 1, it is just a one-call request so I mentioned this as stateless because users will not have a separate endpoint to retrieve anomalies afterwards and hence we could clean up them. In phase 2, another two endpoints will be provided and for those endpoints, we do not need to do the cleanup.
Thanks for your suggestions!",design_debt,non-optimal_design
spark,1270,review,17257206,"`RDD[(Set[Double], Set[Double])]` may be hard for Java users. We can ask users to input `RDD[(Array[Double], Array[Double])]`, requiring that the labels are ordered. It is easier for Java users and faster to compute intersection and other set operations.",design_debt,non-optimal_design
pulsar,5032,review,317796702,"This will require to update this file for each release which is not ideal. We could get the list of versions from `versions.json` though the maven install might take a while to complete.
Another option would be to just build the latest version and make sure we add the version tag, so that we just build 1 version (since the older docs will not change).",design_debt,non-optimal_design
incubator-mxnet,8015,review,141497578,"yes, let's worry about this later.",design_debt,non-optimal_design
kafka,764,review,50764320,"@apovzner Personally I think the timestamp should be accurate. Modifying the timestamp sounds very hacky and creates extra complexity. Please also notice that the timestamp index built by the followers will be purely depending on the timestamp in outer message of compressed messages. The followers will not even decompress the messages. If we play the trick here, the time index on follower will also be affected. 
If we want to make things right, then producer should be able to get the necessary topic configuration info from broker, either from TopicMetadataRequest or some other requests. So the producer can set the timestamp correctly to avoid server side recompression. But like you said this is a bigger change and it is unnecessary to block on that change.
I think the current solution is reasonably clean as of the moment.
Once the producer is able to get the topic configuration from broker, we can simply migrate to use that. Since everything is purely internal, the migration is very simple and transparent to users.",design_debt,non-optimal_design
samza,230,review,124421458,"@sborya I agree it is pretty convoluted how we are doing this. However, @prateekm and I have discussed this option extensively in the past when we are working on [SAMZA-1212](https://issues.apache.org/jira/browse/SAMZA-1212). 
As I explained before , it is not fully clear how to wire-in the source of the stop and cause of the stop of a streamprocessor across the components. I don't believe it is as straightforward as passing in a `Throwable`. It could work. It becomes particularly tricky for bounded jobs or jobs that decide to stop themselves using TaskCoordinator. The approach you are suggesting is equivalent to threading a needle , where we will end up passing around the state/source of the `stop` across the components' api and callbacks. 
The alternative and more straightforward solution, imo, is to clearly define a state model for each components and persist/manage the status in the streamprocessor. That way, it will make it easier for streamprocessor to take remediation steps.
We can discuss more on this. However, this PR is simply a bug-fix. We should scrutinize the refactoring/behavior of the APIs in a separate thread/JIRA. What do you think?",design_debt,non-optimal_design
spark,22847,review,228600757,"it will not be JITted; it also should not not be too small, otherwise there will be many function calls.",design_debt,non-optimal_design
spark,7626,review,35370290,Yea this is right now used by a lot of test code. Somewhat annoying to update those.,design_debt,non-optimal_design
incubator-mxnet,11502,review,200206922,Needs more explanation on what this is used for and how do users use this,documentation_debt,low_quality_documentation
beam,4185,review,153627791,Can you add a comment with an example of an actual value here?,documentation_debt,low_quality_documentation
incubator-pinot,4397,review,307084550,please add some javadoc,documentation_debt,outdated_documentation
flink,12260,review,429716465,"Could you add a short comment for this field to explain why we need this? The same to `CatalogManagerCalciteSchema`, `CatalogSchemaTable`, `DatabaseCalciteSchema`. For example:",documentation_debt,low_quality_documentation
hbase,1077,review,368823636,May be good to update doc for `hbase.coprocessor.regionserver.classes` in section `Restricting Coprocessor Usage` of cp.adoc?,documentation_debt,outdated_documentation
flink,6076,review,190841926,"+1 for getting this into the docs. I offer some grammatical improvements. Also, is it correct to describe ""operators are required to completely process a given watermark before forwarding it downstream"" as a general rule, meaning that it might have exceptions, or should we simply say ""operators are required ..."" without adding this caveat?
I changed behaviour to behavior because most of the docs seem to be using American spellings rather than English ones, but I'm not sure if we have a policy regarding this.",documentation_debt,low_quality_documentation
nifi,1553,review,103938291,Are these comments necessary?,documentation_debt,low_quality_documentation
kafka,241,review,40615287,"Typo. ""Unless the..."" Don't leave us hanging!",documentation_debt,low_quality_documentation
nifi,4369,review,452304677,Typo: configureSasToken(),documentation_debt,low_quality_documentation
incubator-mxnet,8302,review,155828922,The documentation need to be updated. Does copying from mkl-dnn array to sparse ndarray work??,documentation_debt,outdated_documentation
beam,12241,review,454528596,I would add a comment above to state the assumption. But it's minor though.,documentation_debt,low_quality_documentation
apisix,2036,review,487762501,why call `res_fun` twice?,documentation_debt,low_quality_documentation
kafka,158,review,38986690,"just to circle back here - I asked @benstopford to remove the test and doc and do it in a new PR, since they are a bit out of context here.",documentation_debt,outdated_documentation
gobblin,2788,review,351428413,typo: Gobblin config path,documentation_debt,low_quality_documentation
beam,5049,comment,379410687,"Note that this change is not Python 3 compatible since `long` was removed in Python 3.  Can you add something similar to the following?
https://github.com/apache/beam/blob/8d854d4ce0365a8e201b388618d7732f000c65b9/sdks/python/apache_beam/transforms/combiners.py#L39",code_debt,low_quality_code
airflow,3090,comment,370109428,"nit: i think line 68-70 can be removed (to avoid confusion), looks like abandoned legacy code:
thanks for fixing this!",code_debt,dead_code
storm,128,comment,45091287,"I finally made it through all of the code.  It looks good for the most part.  Just a few minor comments.  I also am wiling to maintain/support this code. I have a umber of customers who I know would be very interested in using this, so I would be on the hook for supporting it anyways :)",code_debt,low_quality_code
spark,2761,comment,58776141,"I also think, it's difficult to apply new style checker only to new codes. I cleaned up codes in origin/master for the style checker suggested in this PR.  So, if this PR is merged, then we can enforce the new style to developers and all developers have to do is to check the style of the code changed by them.",code_debt,low_quality_code
spark,9432,comment,154740151,"Oops my bad, also removed the unnecessary sbin/../ from the other tachyon paths",code_debt,complex_code
kafka,5221,comment,399157359,"here are the results on my workstation:
the update path is somewhat slower (because the update must start by 1st copying the latest snapshot and then applying the new data to the copy), but starvation is gone.
also note that metadata codepaths in general do an awful lot of copying - seems to me that converting the entire class to java (or at least making it use 100% java collections) would avoid multiple copies going to/from KafkaApi (all those toJava() calls).",code_debt,slow_algorithm
arrow,1804,comment,377119109,"I'm sorta ambivalent on the package name -- I looked at crates.io and there are some other ASF projects with packages that just use the Foo in Apache Foo. If ""arrow"" is shorter and sweeter, that's no problem",code_debt,low_quality_code
spark,1561,comment,50182962,"Looks good to me, this is definitely cleaner",code_debt,low_quality_code
activemq-artemis,3455,comment,779848243,"@michaelandrepearce this is just code cleanup. Nothing that would bring any value to a release notes...
The commit itself would be enough record of the change here.
If someone is creating a JIRA, it would be a task, as the is not an improvement, not a feature, not a bug fx.. no value on the release notes.",code_debt,low_quality_code
airflow,1435,comment,215288030,"Much thanks for the in-depth review!
Is the scenario you are worrying about (two workers running the same task instance) already possible? For example if a worker's communication with the DB gets interrupted, then the scheduler assigns the task instance to a new worker, and then the communication between the initial worker and the DB resumes.
This makes sense. I misspoke in the PR description though, SLAs should still be sent, the difference would be the SLA email would now omit task instances in the dagrun that didn't succeed for reasons other than depends_on_past not being met (e.g. a task that couldn't run because it's pool was full won't get reported in the email). I think I'm going to just include all tasks that don't have a successful status in the SLA miss email, even those stuck on depends_on_past to align with your criteria (if the task caused core_data to not be delivered by 9AM the task caused the DAG to miss it's SLA regardless of it's depends_on_past_dependency), plus is stops treating depends_on_past differently from the other dependencies like the pool being full. LMK what you think.
Agreed about the efficiency, was going to look into caching if this causes perf issues.
The newfound power of the force flag could be used instead of ignore_depends_on_past, but making ""force"" the default for every backfill could potentially be a bit dangerous as users could e.g. unintentionally force run over a large range of already successful tasks in a backfill or violate a pool constraint. If you have any ideas let me know.
Agreed about not passing in a bunch of different flags. There is actually a TODO above that part of the code in the PR to use a context parameter instead (it will be addressed in this PR).
For the flag upstream_failed I would prefer to leave the fix for another PR since it was an existing hack and the cope of this PR is already a bit dangerously large.",code_debt,low_quality_code
spark,28661,comment,635693433,"Well, I'd say it differently. A Python person may not know what a JVM stack trace means. Taking it away doesn't itself do much except shorten a big dump of output, which doesn't really simplify much. Taking away important information that perhaps someone _else_ can make sense of isn't making usage (debugging) harder. if this is only removing ""unhelpful"" stack traces from the console, I can see it.",code_debt,low_quality_code
kafka,6517,comment,484309340,"@hzxa21 Thanks for the code review.
1)	This consistently happens on Windows platform. I have seen few people complaining similar issues for some Linux flavors, but consensus is this is not an issue for most of the popular Linux flavors. This is a classic windows problem where if a handle is open for a file, NTFS does not allow it to be renamed / moved / deleted. All the file handles open on the file are required to be closed before renaming them. This is not much of an issue with Linux because of the way Linux file system is implemented. The way files are implemented in Linux, it allows to rename / move / delete files even if there are open handles to them.
The way I think about this patch is, before renaming any files / directories, we should always close the file channels. This is applicable to Linux as well. There are 2 fundamental scenarios. 
a)	Deletion of directories since the topic is deleted and deletion of segment files by cleaner thread. We believe, we should close the log file in case of log deletion and close the segment in case of segment file cleanup. Since no one should be reading these files, it is safe to close.
b)	 During swapping flow, where ‘.cleaned’ files are renamed to ‘.swap’ files and then they are renamed to actual log files. Here also we believe segment should be closed during renaming and re-opened after the swap.
Overall gist is, files should be closed before renaming them and should be opened back if required. This should be applicable to Linux as well
2)	Yes, initially we implemented the change in rename files method. But that change turned out to be 
ugly. Here is the abandoned pull request done such way.
https://github.com/Microsoft/kafka/pull/17/files
Problem was, there was no need to re-open ‘.deleted’ files. So we had put an if check to not to re-open ‘.deleted’ file. Also, it resulted in changes at many places.
Also, I felt like it was not a cleaner fix where we are not solving the root problem. Which is to close the segment before they are renamed / deleted. Also, we wanted this to be a generic fix, rather than specific to Windows.
3)	Yes, I can add some test cases. We wanted to get a initial feedback on the idea before adding tests.",code_debt,low_quality_code
spark,17582,comment,294933906,"so we should definitely fix the /api/v1/applications/<app-id>/logs to go through the acls.  It looks like it should be protected in ApiRootResource.java. You have the app id so it needs to do something like the withSparkUI to get the acls included in that application.
Like I mentioned the listing (/api/v1/applications) and /api/v1/applications/<app-id> (which is same info I believe as listing) were intentionally left open.  I don't really see a reason to change that but if other people have a use case for it then perhaps we should make which pages are protected by acls configurable.  
on the history server I would expect spark.acls.enable=false and spark.history.ui.acls.enable=true, I can see where that could be confusing, perhaps we should document this better. spark.acls.enable on the history UI really is protecting the root UI, not the app level ui's.  We could explicitly turn this off.",code_debt,low_quality_code
hive,1780,comment,761269576,Updated PR to improve readability (https://github.com/apache/hive/pull/1780/commits/37e707705c6cc7c025bbe7fb1b67682062dc84c7) and at the same time address HIVE-24646.,code_debt,low_quality_code
pulsar,2888,comment,441582678,"The ""data:"" parser you wrote would be a duplicate code because it's already implemented in the in-house URL class I wrote.  I'm not going to make a change request because I don't want to delay this feature, but either of the parsers should be removed eventually to eliminate duplicate code.
Also, because environment variables are general enough as data sources, I think ""env:"" parser should be added as a `URLStreamHandler` so that other places can use it too via the in-house URL class.
As for ""token:"", I'm ok with having it in this plugin as a special case. But if you renamed it to ""raw:"", it could be used on other places.",code_debt,duplicated_code
spark,23260,comment,446345304,"My understanding is that this allows pointing the Spark UI directly at the history server (old JHS or new ATS) instead of hardcoding the NM URL and relying on the NM redirecting you, since the NM may not exist later on.
That does open up some questions though. The code being modified is in the AM, which means that the user needs to opt into this when he submits the app, when perhaps if there was a way to hook this up on the Spark history server side only, that may be more useful.
I think someone tried that in the past but the SHS change was very YARN-specific, which made it kinda sub-optimal.",code_debt,low_quality_code
dubbo,2741,summary,0,Fixing flaky tests in PortTelnetHandlerTest,test_debt,flaky_test
ignite,6069,summary,0,ignite-11261: [ML] Flaky test(testNaiveBaggingLogRegression),test_debt,flaky_test
trafficserver,5380,summary,0,Fixes spelling in src,documentation_debt,low_quality_documentation
shardingsphere-elasticjob,1608,summary,0,For checkstyle & fix typo,documentation_debt,low_quality_documentation
flink,5663,comment,371969548,Currently in flink connector we are depending only on aws-sdk-kinesis and not on aws-java-sdk-bundle and also don't depend on kinesisvideo. So by default the dependency on kinesisvideo is not included in the connector which means we don't have to exclude any dependencies. I also verified that there is no unwanted netty dependencies by running mvn dependency:tree. The only instance of netty is this: `[INFO] |  +- org.apache.flink:flink-shaded-netty:jar:4.0.27.Final-2.0:provided` in accordance to the value in flink-parent pom.,build_debt,over-declared_dependencies
netbeans,968,comment,430955215,"@geertjanw The XSDs/DTDs are used to generate code and my interpretation of the reply from apache legal is, that the license transcends to the generated code. So for weblogic we would distribute unlicensed code (i.e. we have no right to distribute) and for jboss/wildfly we would distribute LGPL code, which is against the ASF rules.
Getting the XSDs/DTDs at runtime would be perfectly doable, but the modules would need to be reworked to no rely on code generated at build-time.
@vikasprabhakar the DTD files are present here:
https://www.jboss.org/j2ee/dtd/
The files are missing an explicit license and as such I would assume they are covered by the projects LGPL license. That at least is reflected in some of the XSDs I saw. Asking redhat would most probably reveal the same. That still leaves us with the ""wrong"" license.",documentation_debt,low_quality_documentation
druid,2683,comment,198480289,Are these documented?,documentation_debt,outdated_documentation
beam,539,comment,228871382,"My fault. I should open a JIRA issue before I start on this. I thought it is a quick change.
For the WordCount part, I like to move it to a top level class, and document why Spark runners need its own copy. (+@dhalperi for Read.from doesn't work for HDFS)
For the Tfidf part, I think I am close to run it with Spark runner in beam-examples module. #533 
I am having a spark dependency problem in the test (JavaSparkContext class not found):
https://builds.apache.org/job/beam_PreCommit_MavenVerify/1908/console
Could you help me to take a look? And, you can make a call on whether you want to include the Tfidf in this PR or left to me to handle in #533.",documentation_debt,outdated_documentation
flink,1813,comment,229693884,@subhankarb We should also add Redis Sink to the fault tolerance guarantee table for the connectors in the documentation. It can be found at `flink/docs/apis/streaming/fault_tolerance.md`.,documentation_debt,outdated_documentation
spark,16892,comment,280117833,Ok I added back the other test but improved the commenting there.,documentation_debt,low_quality_documentation
lucene-solr,133,summary,0,LUCENE-9069: Prevent memory leaks in PerFieldAnalyzerWrapper,design_debt,non-optimal_design
spark,24300,description,0,"This PR aims to clean up package name mismatches.
Pass the Jenkins.",code_debt,low_quality_code
spark,5511,description,0,"Even if we wrap column names in backticks like ``a#$b.c``,  we still handle the ""."" inside column name specially. I think it's fragile to use a special char to split name parts, why not put name parts in `UnresolvedAttribute` directly?",code_debt,low_quality_code
flink,10753,description,0,"-->
To complete finish the translation work of this page.
This page is about Flink's Table API & SQL. Mainly showing the usage of Table API & SQL, how Flink optimize SQL queries and the difference between Blink and Flink planner. Now it has been translate into Chinese.
This change is a trivial rework / code cleanup without any test coverage.",code_debt,low_quality_code
kafka,6680,description,0,"* Fixed bug in Struct.equals where we returned prematurely and added tests
* Update RequestResponseTest to check that `equals` and `hashCode` of
the struct is the same after serialization/deserialization only when possible.
* Use `Objects.equals` and `Long.hashCode` to simplify code
* Removed deprecated usages of `JUnitTestSuite`",code_debt,complex_code
accumulo,221,description,0,"* Removed log4j config being done in Java but some remains
* Logging is now configured using standard log4j JVM property
  'log4.configuration' in accumulo-env.sh
* Tarball ships with less log4j config files (3 rather than 6)
  which are all log4j properties files.
* Log4j XML can still be used by editing accumulo-env.sh
* Moved AsyncSocketAppend to start module due to classpath issues
* Removed auditLog.xml and added audit log configuration to
  log4j-service & log4j-monitor properties files
* Accumulo conf/ directory no longer has an examples/ directory.
  Configuration files ship in conf/ and are used by default.
* Accumulo monitor by default will bind to 0.0.0.0 but will
  advertise hostname looked up in Java for log forwarding
* Shortened names of logging system properties
* Removed MonitorLoggingIT as it is now difficult to setup log
  forwarding using MiniAccumuloCluster.",code_debt,low_quality_code
kafka,4691,description,0,A few small logging improvements which help debugging replication issues.,code_debt,low_quality_code
zeppelin,3897,description,0,"Travis-CI:
 - remove all environment variables from the build matrix, to use the same cache for all jobs
 - activate the mysql service only when this service is needed
 - activate the xvfb service, when is necessary and possible
 - removed Bower Caching to remove too many complicated lines in Travis-ci
 - Giving the test names
 - Installing R only once with conda, previously it was installed twice with 'testing/install_R.sh' and 'testing/install_external_dependencies.sh
 - remove the R-Cache, because the installation with conda is quite fast
 - Delete 'test/install_R.sh' because it is no longer used
Other:
 - Ignore the tests in 'HeliumApplicationFactoryTest.java' to get the JUnit tests running in the IDE + remove exclude in 'travis.yml
 - Remove deprecation warning in maven-surefire-plugin
 - Helium works better with an absolute path, because a relative path in PATH, is not a good idea for local testing
 - Remove JVM language dependent asserts
Improvement
* https://issues.apache.org/jira/browse/ZEPPELIN-5024
* Travis-CI: https://travis-ci.org/github/Reamer/zeppelin/builds/723116251",code_debt,dead_code
hudi,1664,description,0,"Default value of number of delta commits required to do inline compaction (hoodie.compact.inline.max.delta.commits) is currently 1. Because of this by default every delta commit to MERGE ON READ table is doing inline compaction as well automatically.
I think default value of 1 is little overkill and also it will make MERGE ON READ work like COPY ON WRITE with compaction on every run. I am propsing to increaset the value to old default of 10.
This pull request is a trivial rework / code cleanup without any test coverage.",design_debt,non-optimal_design
spark,26138,description,0,"What changes were proposed in this pull request?
Some of the columns of JDBC/ODBC tab  Session info in Web UI are hard to understand.
Add tool tip for Start time, finish time , Duration and Total Execution
Why are the changes needed?
To improve the understanding of the WebUI
Does this PR introduce any user-facing change?
No
How was this patch tested?
manual test",design_debt,non-optimal_design
