project,pull_number,pull_type,id,text,classification,indicator
kafka,4138,description,0,"Even though this class is internal, it's widely
used by other projects and it's better to avoid
breaking them until we have a publicly supported
test library.",design_debt,non-optimal_design
arrow,7885,review,465480283,Added more test cases for negative numbers and boundary conditions.,test_debt,low_coverage
spark,28841,review,463960973,"Could you add tests for multiple file cases? Probably, I think you might be able to use `(new File(""/tmp/file.csv"")).setLastModified(xxx)` to control timestamp.",test_debt,lack_of_tests
flink,8438,review,287425587,I think we don't need this test here.,test_debt,expensive_tests
flink,9977,review,338932359,"Add a UT test for these coders. For example, we can add a test in `pyflink/fn_execution/tests`.",test_debt,lack_of_tests
spark,29403,review,496341174,"Also, if I'm correct, it would be good to include a test case for this case.  What happens if you actually do operations on the null value stored as an enum?  Is the nullability of the resulting schema correct. Do operations like `.isNotNull` work correctly?",test_debt,lack_of_tests
samza,347,review,180646742,"I haven't measured how much time increase it causes. The purpose of this change is to make each test independent of each other. If we use BeforeClass and AfterClass tags, then these methods need to be static and the variables instantiated (i.e. producer, systemAdmin) needs to be static as well. These variables will then be instantiated exactly once for the test suite and used by all unit tests in this test suite. Thus kind allows interference between tests and make make test development difficult.
During development of this patch the interference must have caused some problem which required me to make this change. I don't exactly remember what that problem is now. But in general it seems like good practice to make unit test independent of each other. What do you think?",test_debt,expensive_tests
spark,6593,description,0,"This also helps us get rid of the sparkr-docs maven profile as docs are now built by just using -Psparkr when the roxygen2 package is available
Related to discussion in #6567 
cc @pwendell @srowen -- Let me know if this looks better",documentation_debt,low_quality_documentation
pulsar,7601,description,0,"-->
Fixes #<xyz>
Master Issue: #<xyz>
This mr adds an api to check if the worker is ready to serve requests.
*Describe the modifications you've done.*
This change is a trivial rework / code cleanup without any test coverage.
This change is already covered by existing tests, such as *(please describe tests)*.
This change added tests and can be verified as follows:
  - If a feature is not applicable for documentation, explain why?
  - If a feature is not documented yet in this PR, please create a followup issue for adding the documentation",documentation_debt,low_quality_documentation
kafka,6475,description,0,"Fix flaky test cases in `WorkerTest` by mocking the `ExecutorService` in `Worker`.  Previously, when using a real thread pool executor, the task may or may not have been run by the executor until the end of the test.
Related JIRA issues:
Ran all tests (`./gradlew test`).
Ran unit tests in `connect/runtime` repeatedly.",test_debt,flaky_test
dubbo,1906,description,0,"#1682: Enhance the test coverage part-4 : dubbo-common/src/main/java/com/alibaba/dubbo/common/status(store|threadpoolutils) modules
dubbo-common/src/test/java/com/alibaba/dubbo/common/utils/UrlUtilsTest.java
XXXXX",test_debt,low_coverage
kafka,9001,review,462716040,Could be moved to `UpdateFeaturesResponse` as a utility.,architecture_debt,violation_of_modularity
airflow,13728,comment,761947640,Temprary failures - it's good to go.,defect_debt,uncorrected_known_defects
activemq-artemis,2241,comment,412575863,"IMO, the JMS pool from 5.x should not be migrated to Artemis.  It belongs in it's own project with it's own release cycle.  Also, it makes sense for it to *not* be in the ActiveMQ project to make clear that the pool is generic and isn't tied to any ActiveMQ broker.
The pool on messaginghub has JMS 2.0 support.",architecture_debt,violation_of_modularity
